{
  "adapter_id": "blue_tanuki_reference",
  "runtime_id": "blue_tanuki",
  "contract_version": "v0.1",
  "transport": "http",
  "authority_strip": true,
  "content_exposure_policy_id": "default_safe",
  "declared_capabilities": [
    "health",
    "ready",
    "runtime_snapshot",
    "authority_trace",
    "notifications",
    "approvals",
    "audit_events",
    "diagnostics_export",
    "recovery"
  ],
  "metadata": {
    "note": "信頼しない。権限を付与してはならない"
  }
}
